{
  "pipeline_mode": "auto_run",
  "execution_complete": true,
  "verification_complete": true,
  "acceptance_complete": true,
  "codex_verdict": "NOT_REQUIRED",
  "commit_pr_status": "committed_locally",
  "current_gate": "acceptance_complete",
  "stopped_reason": "",
  "next_automatic_action": "",
  "user_action_required": false,
  "user_action_reason": "",
  "role_performance": {
    "hermes": {
      "product_manager": true,
      "architect": true,
      "qa_verifier": true
    },
    "claude_code": {
      "implementation_worker": true
    },
    "codex": {
      "role": "plan_and_diff_review",
      "disabled_by_user": false
    }
  },
  "task_classification": {
    "scale": "S",
    "reasons": [
      "Single file change",
      "No new dependencies",
      "Well-understood pattern",
      "No database migration"
    ],
    "risk_level": "low"
  },
  "intake_quality": {
    "original_prompt": "Add a health-check endpoint to the API server that returns uptime and version.",
    "normalized_brief": "Implement GET /health endpoint returning JSON with uptime_seconds and app_version fields. No auth required. Single new route file.",
    "assumptions": [
      "Health endpoint should be unauthenticated",
      "Version string comes from package.json",
      "Uptime tracked via process.uptime()"
    ],
    "questions_asked": 0,
    "proceeded_with_defaults": true,
    "ambiguity_level": "low",
    "product_direction_confidence": "high"
  },
  "skill_trace": {
    "display_language": "zh-CN",
    "current_phase_label": "Hermes 验证",
    "current_phase_internal": "verification",
    "user_visible_skill_banner": true,
    "entry_skill": "dev-pipeline-orchestrator",
    "mode": "auto_run",
    "phase": "verification",
    "hermes_skills": [
      {
        "name": "gstack plan-eng-review",
        "planned": false,
        "used": false,
        "evidence": "",
        "verdict": "SKIPPED",
        "skipped_reason": "S-level health endpoint did not require gstack plan review.",
        "acceptance_impact": "none"
      }
    ],
    "claudecode_skills": [
      {
        "name": "tdd",
        "required": true,
        "reported": true,
        "evidence": {
          "red": "health route test failed before implementation",
          "green": "health route test passed after implementation",
          "commands": ["npm test -- --testPathPattern=health"],
          "exit_codes": [0]
        },
        "verdict": "PASS"
      }
    ],
    "codex_gates": [
      {
        "name": "plan review",
        "required": false,
        "used": false,
        "verdict": "SKIPPED"
      },
      {
        "name": "diff review",
        "required": false,
        "used": false,
        "verdict": "SKIPPED"
      }
    ],
    "policy_check": {
      "planned": true,
      "used": true,
      "exit_code": 0
    },
    "doctor_ci_local": {
      "planned": true,
      "used": true,
      "commands": [
        {
          "command": "bash scripts/ci-local.sh",
          "exit_code": 0
        }
      ]
    },
    "missing_evidence": [],
    "skipped_skills": ["gstack plan-eng-review", "Codex plan review", "Codex diff review"],
    "skipped_reason": "S-level task; gates optional under policy.",
    "acceptance_impact": "none"
  },
  "work_orders": [
    {
      "id": "WO-001",
      "owner": "claude_code",
      "required_skill": "node_api_development",
      "required_matt_skill": "tdd",
      "skill_evidence": {
        "skill": "tdd",
        "red": "health route test failed before implementation",
        "green": "health route test passed after implementation",
        "commands": ["npm test -- --testPathPattern=health"],
        "exit_codes": [0]
      },
      "files": ["src/routes/health.ts"],
      "retry_count": 0,
      "status": "completed",
      "evidence": "Created src/routes/health.ts with GET /health handler returning {uptime_seconds, app_version, status: 'ok'}."
    }
  ],
  "verification_evidence": [
    {
      "command": "npx tsc --noEmit",
      "exit_code": 0,
      "key_output": "No errors found.",
      "pass_fail": "PASS"
    },
    {
      "command": "npm test -- --testPathPattern=health",
      "exit_code": 0,
      "key_output": "Tests: 3 passed, 3 total",
      "pass_fail": "PASS"
    },
    {
      "command": "curl -s http://localhost:3000/health",
      "exit_code": 0,
      "key_output": "{\"uptime_seconds\":42,\"app_version\":\"1.2.0\",\"status\":\"ok\"}",
      "pass_fail": "PASS"
    }
  ],
  "diff_summary": {
    "files_changed": 1,
    "generated_files": ["src/routes/health.ts"],
    "explicit_staged_only": true
  },
  "codex_review": {
    "plan_review_verdict": "not_run",
    "diff_review_verdict": "not_run",
    "blocking_issues": [],
    "remaining_risks": []
  },
  "final_decision": "ACCEPTED",
  "follow_up_backlog": [],
  "safety": {
    "safe_to_stop": true,
    "safe_to_commit": true,
    "safe_to_push_pr": true,
    "follow_up_required_now": false
  }
}
